segment_id	segment_text	sutta	section_num	segment_num	collection	sutta_num	title	place	country
mn1:1.1	So I have heard. At one time the Buddha was staying near Ukkaṭṭhā, in the Subhaga Forest at the root of a magnificent sal tree. There the Buddha addressed the mendicants, “Mendicants!” “Venerable sir,” they replied. The Buddha said this: “Mendicants, I will teach you the explanation of the root of all things. Listen and pay close attention, I will speak.” “Yes, sir,” they replied. The Buddha said this:	mn1	1	1	mn	1	The Root of All Things	near Ukkaṭṭhā, in the Subhaga Forest 	Kosala
mn1:3.1	“Take an uneducated ordinary person who has not seen the noble ones, and is neither skilled nor trained in the teaching of the noble ones. They’ve not seen good persons, and are neither skilled nor trained in the teaching of the good persons. They perceive earth as earth. But then they identify with earth, they identify regarding earth, they identify as earth, they identify that ‘earth is mine’, they take pleasure in earth. Why is that? Because they haven’t completely understood it, I say. They perceive water as water. But then they identify with water … Why is that? Because they haven’t completely understood it, I say. They perceive fire as fire. But then they identify with fire … Why is that? Because they haven’t completely understood it, I say. They perceive air as air. But then they identify with air … Why is that? Because they haven’t completely understood it, I say. They perceive creatures as creatures. But then they identify with creatures … Why is that? Because they haven’t completely understood it, I say. They perceive gods as gods. But then they identify with gods … Why is that? Because they haven’t completely understood it, I say. They perceive the Creator as the Creator. But then they identify with the Creator … Why is that? Because they haven’t completely understood it, I say. They perceive Brahmā as Brahmā. But then they identify with Brahmā … Why is that? Because they haven’t completely understood it, I say. They perceive the gods of streaming radiance as the gods of streaming radiance. But then they identify with the gods of streaming radiance … Why is that? Because they haven’t completely understood it, I say. They perceive the gods replete with glory as the gods replete with glory. But then they identify with the gods replete with glory … Why is that? Because they haven’t completely understood it, I say. They perceive the gods of abundant fruit as the gods of abundant fruit. But then they identify with the gods of abundant fruit … Why is that? Because they haven’t completely understood it, I say. They perceive the Overlord as the Overlord. But then they identify with the Overlord … Why is that? Because they haven’t completely understood it, I say. They perceive the dimension of infinite space as the dimension of infinite space. But then they identify with the dimension of infinite space … Why is that? Because they haven’t completely understood it, I say. They perceive the dimension of infinite consciousness as the dimension of infinite consciousness. But then they identify with the dimension of infinite consciousness … Why is that? Because they haven’t completely understood it, I say. They perceive the dimension of nothingness as the dimension of nothingness. But then they identify with the dimension of nothingness … Why is that? Because they haven’t completely understood it, I say. They perceive the dimension of neither perception nor non-perception as the dimension of neither perception nor non-perception. But then they identify with the dimension of neither perception nor non-perception … Why is that? Because they haven’t completely understood it, I say. They perceive the seen as the seen. But then they identify with the seen … Why is that? Because they haven’t completely understood it, I say. They perceive the heard as the heard. But then they identify with the heard … Why is that? Because they haven’t completely understood it, I say. They perceive the thought as the thought. But then they identify with the thought … Why is that? Because they haven’t completely understood it, I say. They perceive the known as the known. But then they identify with the known … Why is that? Because they haven’t completely understood it, I say. They perceive oneness as oneness. But then they identify with oneness … Why is that? Because they haven’t completely understood it, I say. They perceive diversity as diversity. But then they identify with diversity … Why is that? Because they haven’t completely understood it, I say. They perceive all as all. But then they identify with all … Why is that? Because they haven’t completely understood it, I say. They perceive extinguishment as extinguishment. But then they identify with extinguishment, they identify regarding extinguishment, they identify as extinguishment, they identify that ‘extinguishment is mine’, they take pleasure in extinguishment. Why is that? Because they haven’t completely understood it, I say.	mn1	3	1	mn	1	The Root of All Things	near Ukkaṭṭhā, in the Subhaga Forest 	Kosala
mn1:27.1	A mendicant who is a trainee, who hasn’t achieved their heart’s desire, but lives aspiring to the supreme sanctuary, directly knows earth as earth. But they shouldn’t identify with earth, they shouldn’t identify regarding earth, they shouldn’t identify as earth, they shouldn’t identify that ‘earth is mine’, they shouldn’t take pleasure in earth. Why is that? So that they may completely understand it, I say. They directly know water … fire … air … creatures … gods … the Creator … Brahmā … the gods of streaming radiance … the gods replete with glory … the gods of abundant fruit … the Overlord … the dimension of infinite space … the dimension of infinite consciousness … the dimension of nothingness … the dimension of neither perception nor non-perception … the seen … the heard … the thought … the known … oneness … diversity … all … They directly know extinguishment as extinguishment. But they shouldn’t identify with extinguishment, they shouldn’t identify regarding extinguishment, they shouldn’t identify as extinguishment, they shouldn’t identify that ‘extinguishment is mine’, they shouldn’t take pleasure in extinguishment. Why is that? So that they may completely understand it, I say.	mn1	27	1	mn	1	The Root of All Things	near Ukkaṭṭhā, in the Subhaga Forest 	Kosala
mn1:51.1	A mendicant who is perfected—with defilements ended, who has completed the spiritual journey, done what had to be done, laid down the burden, achieved their own true goal, utterly ended the fetters of rebirth, and is rightly freed through enlightenment—directly knows earth as earth. But they don’t identify with earth, they don’t identify regarding earth, they don’t identify as earth, they don’t identify that ‘earth is mine’, they don’t take pleasure in earth. Why is that? Because they have completely understood it, I say. They directly know water … fire … air … creatures … gods … the Creator … Brahmā … the gods of streaming radiance … the gods replete with glory … the gods of abundant fruit … the Overlord … the dimension of infinite space … the dimension of infinite consciousness … the dimension of nothingness … the dimension of neither perception nor non-perception … the seen … the heard … the thought … the known … oneness … diversity … all … They directly know extinguishment as extinguishment. But they don’t identify with extinguishment, they don’t identify regarding extinguishment, they don’t identify as extinguishment, they don’t identify that ‘extinguishment is mine’, they don’t take pleasure in extinguishment. Why is that? Because they have completely understood it, I say. A mendicant who is perfected—with defilements ended, who has completed the spiritual journey, done what had to be done, laid down the burden, achieved their own true goal, utterly ended the fetters of rebirth, and is rightly freed through enlightenment—directly knows earth as earth. But they don’t identify with earth, they don’t identify regarding earth, they don’t identify as earth, they don’t identify that ‘earth is mine’, they don’t take pleasure in earth. Why is that? Because they’re free of greed due to the ending of greed. They directly know water … fire … air … creatures … gods … the Creator … Brahmā … the gods of streaming radiance … the gods replete with glory … the gods of abundant fruit … the Overlord … the dimension of infinite space … the dimension of infinite consciousness … the dimension of nothingness … the dimension of neither perception nor non-perception … the seen … the heard … the thought … the known … oneness … diversity … all … They directly know extinguishment as extinguishment. But they don’t identify with extinguishment, they don’t identify regarding extinguishment, they don’t identify as extinguishment, they don’t identify that ‘extinguishment is mine’, they don’t take pleasure in extinguishment. Why is that? Because they’re free of greed due to the ending of greed.	mn1	51	1	mn	1	The Root of All Things	near Ukkaṭṭhā, in the Subhaga Forest 	Kosala
mn1:99.1	A mendicant who is perfected—with defilements ended, who has completed the spiritual journey, done what had to be done, laid down the burden, achieved their own true goal, utterly ended the fetters of rebirth, and is rightly freed through enlightenment—directly knows earth as earth. But they don’t identify with earth, they don’t identify regarding earth, they don’t identify as earth, they don’t identify that ‘earth is mine’, they don’t take pleasure in earth. Why is that? Because they’re free of hate due to the ending of hate. They directly know water … fire … air … creatures … gods … the Creator … Brahmā … the gods of streaming radiance … the gods replete with glory … the gods of abundant fruit … the Overlord … the dimension of infinite space … the dimension of infinite consciousness … the dimension of nothingness … the dimension of neither perception nor non-perception … the seen … the heard … the thought … the known … oneness … diversity … all … They directly know extinguishment as extinguishment. But they don’t identify with extinguishment, they don’t identify regarding extinguishment, they don’t identify as extinguishment, they don’t identify that ‘extinguishment is mine’, they don’t take pleasure in extinguishment. Why is that? Because they’re free of hate due to the ending of hate.	mn1	99	1	mn	1	The Root of All Things	near Ukkaṭṭhā, in the Subhaga Forest 	Kosala
mn1:123.1	A mendicant who is perfected—with defilements ended, who has completed the spiritual journey, done what had to be done, laid down the burden, achieved their own true goal, utterly ended the fetters of rebirth, and is rightly freed through enlightenment—directly knows earth as earth. But they don’t identify with earth, they don’t identify regarding earth, they don’t identify as earth, they don’t identify that ‘earth is mine’, they don’t take pleasure in earth. Why is that? Because they’re free of delusion due to the ending of delusion. They directly know water … fire … air … creatures … gods … the Creator … Brahmā … the gods of streaming radiance … the gods replete with glory … the gods of abundant fruit … the Overlord … the dimension of infinite space … the dimension of infinite consciousness … the dimension of nothingness … the dimension of neither perception nor non-perception … the seen … the heard … the thought … the known … oneness … diversity … all … They directly know extinguishment as extinguishment. But they don’t identify with extinguishment, they don’t identify regarding extinguishment, they don’t identify as extinguishment, they don’t identify that ‘extinguishment is mine’, they don’t take pleasure in extinguishment. Why is that? Because they’re free of delusion due to the ending of delusion.	mn1	123	1	mn	1	The Root of All Things	near Ukkaṭṭhā, in the Subhaga Forest 	Kosala
mn1:147.1	The Realized One, the perfected one, the fully awakened Buddha directly knows earth as earth. But he doesn’t identify with earth, he doesn’t identify regarding earth, he doesn’t identify as earth, he doesn’t identify that ‘earth is mine’, he doesn’t take pleasure in earth. Why is that? Because the Realized One has completely understood it to the end, I say. He directly knows water … fire … air … creatures … gods … the Creator … Brahmā … the gods of streaming radiance … the gods replete with glory … the gods of abundant fruit … the Overlord … the dimension of infinite space … the dimension of infinite consciousness … the dimension of nothingness … the dimension of neither perception nor non-perception … the seen … the heard … the thought … the known … oneness … diversity … all … He directly knows extinguishment as extinguishment. But he doesn’t identify with extinguishment, he doesn’t identify regarding extinguishment, he doesn’t identify as extinguishment, he doesn’t identify that ‘extinguishment is mine’, he doesn’t take pleasure in extinguishment. Why is that? Because the Realized One has completely understood it to the end, I say.	mn1	147	1	mn	1	The Root of All Things	near Ukkaṭṭhā, in the Subhaga Forest 	Kosala
mn1:171.1	The Realized One, the perfected one, the fully awakened Buddha directly knows earth as earth. But he doesn’t identify with earth, he doesn’t identify regarding earth, he doesn’t identify as earth, he doesn’t identify that ‘earth is mine’, he doesn’t take pleasure in earth. Why is that? Because he has understood that relishing is the root of suffering, and that rebirth comes from continued existence; whoever has come to be gets old and dies. That’s why the Realized One—with the ending, fading away, cessation, giving up, and letting go of all cravings—has awakened to the supreme perfect Awakening, I say. He directly knows water … fire … air … creatures … gods … the Creator … Brahmā … the gods of streaming radiance … the gods replete with glory … the gods of abundant fruit … the Overlord … the dimension of infinite space … the dimension of infinite consciousness … the dimension of nothingness … the dimension of neither perception nor non-perception … the seen … the heard … the thought … the known … oneness … diversity … all … He directly knows extinguishment as extinguishment. But he doesn’t identify with extinguishment, he doesn’t identify regarding extinguishment, he doesn’t identify as extinguishment, he doesn’t identify that ‘extinguishment is mine’, he doesn’t take pleasure in extinguishment. Why is that? Because he has understood that relishing is the root of suffering, and that rebirth comes from continued existence; whoever has come to be gets old and dies. That’s why the Realized One—with the ending, fading away, cessation, giving up, and letting go of all cravings—has awakened to the supreme perfect Awakening, I say.”	mn1	171	1	mn	1	The Root of All Things	near Ukkaṭṭhā, in the Subhaga Forest 	Kosala
mn1:172-194.30	That is what the Buddha said. But the mendicants were not happy with what the Buddha said.	mn1	172-194	30	mn	1	The Root of All Things	near Ukkaṭṭhā, in the Subhaga Forest 	Kosala
mn2:1.1	So I have heard. At one time the Buddha was staying near Sāvatthī in Jeta’s Grove, Anāthapiṇḍika’s monastery. There the Buddha addressed the mendicants, “Mendicants!” “Venerable sir,” they replied. The Buddha said this: “Mendicants, I will teach you the explanation of the restraint of all defilements. Listen and pay close attention, I will speak.” “Yes, sir,” they replied. The Buddha said this:	mn2	1	1	mn	2	All the Defilements	near Sāvatthī in Jeta’s Grove, Anāthapiṇḍika’s monastery	Kosala
mn2:3.1	“Mendicants, I say that the ending of defilements is for one who knows and sees, not for one who does not know or see. For one who knows and sees what? Proper attention and improper attention. When you pay improper attention, defilements arise, and once arisen they grow. When you pay proper attention, defilements don’t arise, and those that have already arisen are given up.	mn2	3	1	mn	2	All the Defilements	near Sāvatthī in Jeta’s Grove, Anāthapiṇḍika’s monastery	Kosala
mn2:4.1	Some defilements should be given up by seeing, some by restraint, some by using, some by enduring, some by avoiding, some by dispelling, and some by developing.	mn2	4	1	mn	2	All the Defilements	near Sāvatthī in Jeta’s Grove, Anāthapiṇḍika’s monastery	Kosala
mn2:5.1	And what are the defilements that should be given up by seeing? Take an uneducated ordinary person who has not seen the noble ones, and is neither skilled nor trained in the teaching of the noble ones. They’ve not seen good persons, and are neither skilled nor trained in the teaching of the good persons. They don’t understand to which things they should pay attention and to which things they should not pay attention. So they pay attention to things they shouldn’t and don’t pay attention to things they should.	mn2	5	1	mn	2	All the Defilements	near Sāvatthī in Jeta’s Grove, Anāthapiṇḍika’s monastery	Kosala
mn2:6.1	And what are the things to which they pay attention but should not? They are the things that, when attention is paid to them, give rise to unarisen defilements and make arisen defilements grow; the defilements of sensual desire, desire to be reborn, and ignorance. These are the things to which they pay attention but should not. And what are the things to which they do not pay attention but should? They are the things that, when attention is paid to them, do not give rise to unarisen defilements and give up arisen defilements; the defilements of sensual desire, desire to be reborn, and ignorance. These are the things to which they do not pay attention but should.	mn2	6	1	mn	2	All the Defilements	near Sāvatthī in Jeta’s Grove, Anāthapiṇḍika’s monastery	Kosala
mn2:7.1	Because of paying attention to what they should not and not paying attention to what they should, unarisen defilements arise and arisen defilements grow. This is how they attend improperly: ‘Did I exist in the past? Did I not exist in the past? What was I in the past? How was I in the past? After being what, what did I become in the past? Will I exist in the future? Will I not exist in the future? What will I be in the future? How will I be in the future? After being what, what will I become in the future?’ Or they are undecided about the present thus: ‘Am I? Am I not? What am I? How am I? This sentient being—where did it come from? And where will it go?’ When they attend improperly in this way, one of the following six views arises in them and is taken as a genuine fact. The view: ‘My self exists in an absolute sense.’ The view: ‘My self does not exist in an absolute sense.’ The view: ‘I perceive the self with the self.’ The view: ‘I perceive what is not-self with the self.’ The view: ‘I perceive the self with what is not-self.’ Or they have such a view: ‘This self of mine is he who speaks and feels and experiences the results of good and bad deeds in all the different realms. This self is permanent, everlasting, eternal, and imperishable, and will last forever and ever.’ This is called a misconception, the thicket of views, the desert of views, the trick of views, the evasiveness of views, the fetter of views. An uneducated ordinary person who is fettered by views is not freed from rebirth, old age, and death, from sorrow, lamentation, pain, sadness, and distress. They’re not freed from suffering, I say.	mn2	7	1	mn	2	All the Defilements	near Sāvatthī in Jeta’s Grove, Anāthapiṇḍika’s monastery	Kosala
mn2:9.2	But take an educated noble disciple who has seen the noble ones, and is skilled and trained in the teaching of the noble ones. They’ve seen good persons, and are skilled and trained in the teaching of the good persons. They understand to which things they should pay attention and to which things they should not pay attention. So they pay attention to things they should and don’t pay attention to things they shouldn’t. And what are the things to which they don’t pay attention and should not? They are the things that, when attention is paid to them, give rise to unarisen defilements and make arisen defilements grow; the defilements of sensual desire, desire to be reborn, and ignorance. These are the things to which they don’t pay attention and should not. And what are the things to which they do pay attention and should? They are the things that, when attention is paid to them, do not give rise to unarisen defilements and give up arisen defilements; the defilements of sensual desire, desire to be reborn, and ignorance. These are the things to which they do pay attention and should. Because of not paying attention to what they should not and paying attention to what they should, unarisen defilements don’t arise and arisen defilements are given up.	mn2	9	2	mn	2	All the Defilements	near Sāvatthī in Jeta’s Grove, Anāthapiṇḍika’s monastery	Kosala
mn2:11.1	They properly attend: ‘This is suffering’ … ‘This is the origin of suffering’ … ‘This is the cessation of suffering’ … ‘This is the practice that leads to the cessation of suffering’. And as they do so, they give up three fetters: identity view, doubt, and misapprehension of precepts and observances. These are called the defilements that should be given up by seeing.	mn2	11	1	mn	2	All the Defilements	near Sāvatthī in Jeta’s Grove, Anāthapiṇḍika’s monastery	Kosala
mn2:12.1	And what are the defilements that should be given up by restraint? Take a mendicant who, reflecting properly, lives restraining the faculty of the eye. For the distressing and feverish defilements that might arise in someone who lives without restraint of the eye faculty do not arise when there is such restraint. Reflecting properly, they live restraining the faculty of the ear … the nose … the tongue … the body … the mind. For the distressing and feverish defilements that might arise in someone who lives without restraint of the mind faculty do not arise when there is such restraint. For the distressing and feverish defilements that might arise in someone who lives without restraint do not arise when there is such restraint. These are called the defilements that should be given up by restraint.	mn2	12	1	mn	2	All the Defilements	near Sāvatthī in Jeta’s Grove, Anāthapiṇḍika’s monastery	Kosala
mn2:13.1	And what are the defilements that should be given up by using? Take a mendicant who, reflecting properly, makes use of robes: ‘Only for the sake of warding off cold and heat; for warding off the touch of flies, mosquitoes, wind, sun, and reptiles; and for covering up the private parts.’ Reflecting properly, they make use of almsfood: ‘Not for fun, indulgence, adornment, or decoration, but only to sustain this body, to avoid harm, and to support spiritual practice. In this way, I shall put an end to old discomfort and not give rise to new discomfort, and I will live blamelessly and at ease.’ Reflecting properly, they make use of lodgings: ‘Only for the sake of warding off cold and heat; for warding off the touch of flies, mosquitoes, wind, sun, and reptiles; to shelter from harsh weather and to enjoy retreat.’ Reflecting properly, they make use of medicines and supplies for the sick: ‘Only for the sake of warding off the pains of illness and to promote good health.’ For the distressing and feverish defilements that might arise in someone who lives without using these things do not arise when they are used. These are called the defilements that should be given up by using.	mn2	13	1	mn	2	All the Defilements	near Sāvatthī in Jeta’s Grove, Anāthapiṇḍika’s monastery	Kosala
mn2:18.1	And what are the defilements that should be given up by enduring? Take a mendicant who, reflecting properly, endures cold, heat, hunger, and thirst. They endure the touch of flies, mosquitoes, wind, sun, and reptiles. They endure rude and unwelcome criticism. And they put up with physical pain—sharp, severe, acute, unpleasant, disagreeable, and life-threatening. For the distressing and feverish defilements that might arise in someone who lives without enduring these things do not arise when they are endured. These are called the defilements that should be given up by enduring.	mn2	18	1	mn	2	All the Defilements	near Sāvatthī in Jeta’s Grove, Anāthapiṇḍika’s monastery	Kosala
