segment_id	segment_text	sutta	section_num	segment_num	collection	sutta_num	title	place	country
mn21:1.1	So I have heard. At one time the Buddha was staying near Sāvatthī in Jeta’s Grove, Anāthapiṇḍika’s monastery. Now at that time, Venerable Phagguna of the Top-Knot was mixing too closely together with the nuns. So much so that if any mendicant criticized those nuns in his presence, Phagguna of the Top-Knot got angry and upset, and even instigated disciplinary proceedings. And if any mendicant criticized Phagguna of the Top-Knot in their presence, those nuns got angry and upset, and even instigated disciplinary proceedings. That’s how much Phagguna of the Top-Knot was mixing too closely together with the nuns. Then a mendicant went up to the Buddha, bowed, sat down to one side, and told him what was going on. So the Buddha addressed a certain monk, “Please, monk, in my name tell the mendicant Phagguna of the Top-Knot that the teacher summons him.” “Yes, sir,” that monk replied. He went to Phagguna of the Top-Knot and said to him, “Reverend Phagguna, the teacher summons you.” “Yes, reverend,” Phagguna replied. He went to the Buddha, bowed, and sat down to one side. The Buddha said to him:	mn21	1	1	mn	21	The Simile of the Saw	near Sāvatthī in Jeta’s Grove, Anāthapiṇḍika’s monastery	Kosala
mn21:5.1	“Is it really true, Phagguna, that you’ve been mixing overly closely together with the nuns? So much so that if any mendicant criticizes those nuns in your presence, you get angry and upset, and even instigate disciplinary proceedings? And if any mendicant criticizes you in those nuns’ presence, they get angry and upset, and even instigate disciplinary proceedings? Is that how much you’re mixing overly closely together with the nuns?” “Yes, sir.” “Phagguna, are you not a gentleman who has gone forth from the lay life to homelessness?” “Yes, sir.” “As such, it’s not appropriate for you to mix so closely with the nuns. So if anyone criticizes those nuns in your presence, you should give up any desires or thoughts of the lay life. If that happens, you should train like this: ‘My mind will be unaffected. I will blurt out no bad words. I will remain full of compassion, with a heart of love and no secret hate.’ That’s how you should train. So even if someone strikes those nuns with fists, stones, rods, and swords in your presence, you should give up any desires or thoughts of the lay life. If that happens, you should train like this: ‘My mind will be unaffected. I will blurt out no bad words. I will remain full of compassion, with a heart of love and no secret hate.’ That’s how you should train. So if anyone criticizes you in your presence, you should give up any desires or thoughts of the lay life. If that happens, you should train like this: ‘My mind will be unaffected. I will blurt out no bad words. I will remain full of compassion, with a heart of love and no secret hate.’ That’s how you should train. So Phagguṇa, even if someone strikes you with fists, stones, rods, and swords, you should give up any desires or thoughts of the lay life. If that happens, you should train like this: ‘My mind will be unaffected. I will blurt out no bad words. I will remain full of compassion, with a heart of love and no secret hate.’ That’s how you should train.”	mn21	5	1	mn	21	The Simile of the Saw	near Sāvatthī in Jeta’s Grove, Anāthapiṇḍika’s monastery	Kosala
mn21:7.1	Then the Buddha said to the mendicants: “Mendicants, I used to be satisfied with the mendicants. Once, I addressed them: ‘I eat my food in one sitting per day. Doing so, I find that I’m healthy and well, nimble, strong, and living comfortably. You too should eat your food in one sitting per day. Doing so, you’ll find that you’re healthy and well, nimble, strong, and living comfortably.’ I didn’t have to keep on instructing those mendicants; I just had to prompt their mindfulness. Suppose a chariot stood harnessed to thoroughbreds at a level crossroads, with a goad ready. Then a deft horse trainer, a master charioteer, might mount the chariot, taking the reins in his right hand and goad in the left. He’d drive out and back wherever he wishes, whenever he wishes. In the same way, I didn’t have to keep on instructing those mendicants; I just had to prompt their mindfulness. So, mendicants, you too should give up what’s unskillful and devote yourselves to skillful qualities. In this way you’ll achieve growth, improvement, and maturity in this teaching and training. Suppose that not far from a town or village there was a large grove of sal trees that was choked with castor-oil weeds. Then along comes a person who wants to help protect and nurture that grove. They’d cut down the crooked sal saplings that were robbing the sap, and throw them out. They’d clean up the interior of the grove, and properly care for the straight, well-formed sal saplings. In this way, in due course, that sal grove would grow, increase, and mature. In the same way, mendicants, you too should give up what’s unskillful and devote yourselves to skillful qualities. In this way you’ll achieve growth, improvement, and maturity in this teaching and training.	mn21	7	1	mn	21	The Simile of the Saw	near Sāvatthī in Jeta’s Grove, Anāthapiṇḍika’s monastery	Kosala
mn21:9.1	Once upon a time, mendicants, right here in Sāvatthī there was a housewife named Vedehikā. She had this good reputation: ‘The housewife Vedehikā is sweet, even-tempered, and calm.’ Now, Vedehikā had a bonded maid named Kāḷī who was skilled, tireless, and well-organized in her work. Then Kāḷī thought, ‘My mistress has a good reputation as being sweet, even-tempered, and calm. But does she actually have anger in her and just not show it? Or does she have no anger? Or is it just because my work is well-organized that she doesn’t show anger, even though she still has it inside? Why don’t I test my mistress?’ So Kāḷī got up during the day. Vedehikā said to her, ‘What the hell, Kāḷī!’ ‘What is it, madam?’ ‘You’re getting up in the day—what’s up with you, girl?’ ‘Nothing, madam.’ ‘Nothing’s up, you bad girl, but you get up in the day!’ Angry and upset, she scowled. Then Kāḷī thought, ‘My mistress actually has anger in her and just doesn’t show it; it’s not that she has no anger. It’s just because my work is well-organized that she doesn’t show anger, even though she still has it inside. Why don’t I test my mistress further?’ So Kāḷī got up later in the day. Vedehikā said to her, ‘What the hell, Kāḷī!’ ‘What is it, madam?’ ‘You’re getting up later in the day—what’s up with you, girl?’ ‘Nothing, madam.’ ‘Nothing’s up, you bad girl, but you get up later in the day!’ Angry and upset, she blurted out angry words. Then Kāḷī thought, ‘My mistress actually has anger in her and just doesn’t show it; it’s not that she has no anger. It’s just because my work is well-organized that she doesn’t show anger, even though she still has it inside. Why don’t I test my mistress further?’ So Kāḷī got up even later in the day. Vedehikā said to her, ‘What the hell, Kāḷī!’ ‘What is it, madam?’ ‘You’re getting up even later in the day—what’s up with you, girl?’ ‘Nothing, madam.’ ‘Nothing’s up, you bad girl, but you get up even later in the day!’ Angry and upset, she grabbed a rolling-pin and hit Kāḷī on the head, cracking it open. Then Kāḷī, with blood pouring from her cracked skull, denounced her mistress to the neighbors, ‘See, ladies, what the sweet one did! See what the even-tempered one did! See what the calm one did! How on earth can she grab a rolling-pin and hit her only maid on the head, cracking it open, just for getting up late?’ Then after some time the housewife Vedehikā got this bad reputation: ‘The housewife Vedehikā is fierce, ill-tempered, and not calm at all.’ In the same way, a mendicant may be the sweetest of the sweet, the most even-tempered of the even-tempered, the calmest of the calm, so long as they don’t encounter any disagreeable criticism. But it’s when they encounter disagreeable criticism that you’ll know whether they’re really sweet, even-tempered, and calm. I don’t say that a mendicant is easy to admonish if they make themselves easy to admonish only for the sake of robes, almsfood, lodgings, and medicines and supplies for the sick. Why is that? Because when they don’t get robes, almsfood, lodgings, and medicines and supplies for the sick, they’re no longer easy to admonish. But when a mendicant is easy to admonish purely because they honor, respect, revere, worship, and venerate the teaching, then I say that they’re easy to admonish. So, mendicants, you should train yourselves: ‘We will be easy to admonish purely because we honor, respect, revere, worship, and venerate the teaching.’ That’s how you should train.	mn21	9	1	mn	21	The Simile of the Saw	near Sāvatthī in Jeta’s Grove, Anāthapiṇḍika’s monastery	Kosala
mn21:11.1	Mendicants, there are these five ways in which others might criticize you. Their speech may be timely or untimely, true or false, gentle or harsh, beneficial or harmful, from a heart of love or from secret hate. When others criticize you, they may do so in any of these ways. If that happens, you should train like this: ‘Our minds will remain unaffected. We will blurt out no bad words. We will remain full of compassion, with a heart of love and no secret hate. We will meditate spreading a heart of love to that person. And with them as a basis, we will meditate spreading a heart full of love to everyone in the world—abundant, expansive, limitless, free of enmity and ill will.’ That’s how you should train.	mn21	11	1	mn	21	The Simile of the Saw	near Sāvatthī in Jeta’s Grove, Anāthapiṇḍika’s monastery	Kosala
mn21:12.1	Suppose a person was to come along carrying a spade and basket and say, ‘I shall make this great earth be without earth!’ And they’d dig all over, scatter all over, spit all over, and urinate all over, saying, ‘Be without earth! Be without earth!’ What do you think, mendicants? Could that person make this great earth be without earth?” “No, sir. Why is that? Because this great earth is deep and limitless. It’s not easy to make it be without earth. That person will eventually get weary and frustrated.” “In the same way, there are these five ways in which others might criticize you. Their speech may be timely or untimely, true or false, gentle or harsh, beneficial or harmful, from a heart of love or from secret hate. When others criticize you, they may do so in any of these ways. If that happens, you should train like this: ‘Our minds will remain unaffected. We will blurt out no bad words. We will remain full of compassion, with a heart of love and no secret hate. We will meditate spreading a heart of love to that person. And with them as a basis, we will meditate spreading a heart like the earth to everyone in the world—abundant, expansive, limitless, free of enmity and ill will.’ That’s how you should train. Suppose a person was to come along with dye such as red lac, turmeric, indigo, or rose madder, and say, ‘I shall draw pictures on the sky, making pictures appear there.’ What do you think, mendicants? Could that person draw pictures on the sky?” “No, sir. Why is that? Because the sky is formless and invisible. It’s not easy to draw pictures there. That person will eventually get weary and frustrated.” “In the same way, there are these five ways in which others might criticize you … Suppose a person was to come along carrying a blazing grass torch, and say, ‘I shall burn and scorch the river Ganges with this blazing grass torch.’ What do you think, mendicants? Could that person burn and scorch the river Ganges with a blazing grass torch?” “No, sir. Why is that? Because the river Ganges is deep and limitless. It’s not easy to burn and scorch it with a blazing grass torch. That person will eventually get weary and frustrated.” “In the same way, there are these five ways in which others might criticize you … Suppose there was a catskin bag that was rubbed, well-rubbed, very well-rubbed, soft, silky, rid of rustling and crackling. Then a person comes along carrying a stick or a stone, and says, ‘I shall make this soft catskin bag rustle and crackle with this stick or stone.’ What do you think, mendicants? Could that person make that soft catskin bag rustle and crackle with that stick or stone?” “No, sir. Why is that? Because that catskin bag is rubbed, well-rubbed, very well-rubbed, soft, silky, rid of rustling and crackling. It’s not easy to make it rustle or crackle with a stick or stone. That person will eventually get weary and frustrated.” “In the same way, there are these five ways in which others might criticize you. Their speech may be timely or untimely, true or false, gentle or harsh, beneficial or harmful, from a heart of love or from secret hate. When others criticize you, they may do so in any of these ways. If that happens, you should train like this: ‘Our minds will remain unaffected. We will blurt out no bad words. We will remain full of compassion, with a heart of love and no secret hate. We will meditate spreading a heart of love to that person. And with them as a basis, we will meditate spreading a heart like a catskin bag to everyone in the world—abundant, expansive, limitless, free of enmity and ill will.’ That’s how you should train. Even if low-down bandits were to sever you limb from limb, anyone who had a malevolent thought on that account would not be following my instructions. If that happens, you should train like this: ‘Our minds will remain unaffected. We will blurt out no bad words. We will remain full of compassion, with a heart of love and no secret hate. We will meditate spreading a heart of love to that person. And with them as a basis, we will meditate spreading a heart full of love to everyone in the world—abundant, expansive, limitless, free of enmity and ill will.’ That’s how you should train.	mn21	12	1	mn	21	The Simile of the Saw	near Sāvatthī in Jeta’s Grove, Anāthapiṇḍika’s monastery	Kosala
mn21:21.1	If you frequently reflect on this advice—the simile of the saw— do you see any criticism, large or small, that you could not endure?” “No, sir.” “So, mendicants, you should frequently reflect on this advice, the simile of the saw. This will be for your lasting welfare and happiness.” That is what the Buddha said. Satisfied, the mendicants were happy with what the Buddha said.	mn21	21	1	mn	21	The Simile of the Saw	near Sāvatthī in Jeta’s Grove, Anāthapiṇḍika’s monastery	Kosala
mn22:1.1	So I have heard. At one time the Buddha was staying near Sāvatthī in Jeta’s Grove, Anāthapiṇḍika’s monastery.	mn22	1	1	mn	22	The Simile of the Snake	near Sāvatthī in Jeta’s Grove, Anāthapiṇḍika’s monastery	Kosala
mn22:2.1	Now at that time a mendicant called Ariṭtha, who had previously been a vulture trapper, had the following harmful misconception: “As I understand the Buddha’s teachings, the acts that he says are obstructions are not really obstructions for the one who performs them.” Several mendicants heard about this. They went up to Ariṭṭha and said to him, “Is it really true, Reverend Ariṭṭha, that you have such a harmful misconception: ‘As I understand the Buddha’s teachings, the acts that he says are obstructions are not really obstructions for the one who performs them’?” “Absolutely, reverends. As I understand the Buddha’s teachings, the acts that he says are obstructions are not really obstructions for the one who performs them.” Then, wishing to dissuade Ariṭṭha from his view, the mendicants pursued, pressed, and grilled him, “Don’t say that, Ariṭṭha! Don’t misrepresent the Buddha, for misrepresentation of the Buddha is not good. And the Buddha would not say that. In many ways the Buddha has said that obstructive acts are obstructive, and that they really do obstruct the one who performs them. The Buddha says that sensual pleasures give little gratification and much suffering and distress, and they are all the more full of drawbacks. With the similes of a skeleton … a lump of meat … a grass torch … a pit of glowing coals … a dream … borrowed goods … fruit on a tree … a butcher’s knife and chopping block … a staking sword … a snake’s head, the Buddha says that sensual pleasures give little gratification and much suffering and distress, and they are all the more full of drawbacks.” But even though the mendicants pursued, pressed, and grilled him in this way, Ariṭṭha obstinately stuck to his misconception and insisted on stating it. When they weren’t able to dissuade Ariṭṭha from his view, the mendicants went to the Buddha, bowed, sat down to one side, and told him what had happened.	mn22	2	1	mn	22	The Simile of the Snake	near Sāvatthī in Jeta’s Grove, Anāthapiṇḍika’s monastery	Kosala
mn22:5.1	So the Buddha addressed a certain monk, “Please, monk, in my name tell the mendicant Ariṭṭha, formerly a vulture trapper, that the teacher summons him.” “Yes, sir,” that monk replied. He went to Ariṭṭha and said to him, “Reverend Ariṭṭha, the teacher summons you.” “Yes, reverend,” Ariṭṭha replied. He went to the Buddha, bowed, and sat down to one side. The Buddha said to him, “Is it really true, Ariṭṭha, that you have such a harmful misconception: ‘As I understand the Buddha’s teachings, the acts that he says are obstructions are not really obstructions for the one who performs them’?” “Absolutely, sir. As I understand the Buddha’s teachings, the acts that he says are obstructions are not really obstructions for the one who performs them.”	mn22	5	1	mn	22	The Simile of the Snake	near Sāvatthī in Jeta’s Grove, Anāthapiṇḍika’s monastery	Kosala
mn22:6.1	“Silly man, who on earth have you ever known me to teach in that way? Haven’t I said in many ways that obstructive acts are obstructive, and that they really do obstruct the one who performs them? I’ve said that sensual pleasures give little gratification and much suffering and distress, and they are all the more full of drawbacks. With the similes of a skeleton … a lump of meat … a grass torch … a pit of glowing coals … a dream … borrowed goods … fruit on a tree … a butcher’s knife and chopping block … a staking sword … a snake’s head, I’ve said that sensual pleasures give little gratification and much suffering and distress, and they are all the more full of drawbacks. But still you misrepresent me by your wrong grasp, harm yourself, and make much bad karma. This will be for your lasting harm and suffering.”	mn22	6	1	mn	22	The Simile of the Snake	near Sāvatthī in Jeta’s Grove, Anāthapiṇḍika’s monastery	Kosala
mn22:7.1	Then the Buddha said to the mendicants, “What do you think, mendicants? Has this mendicant Ariṭṭha kindled even a spark of wisdom in this teaching and training?” “How could that be, sir? No, sir.” When this was said, Ariṭṭha sat silent, embarrassed, shoulders drooping, downcast, depressed, with nothing to say. Knowing this, the Buddha said, “Silly man, you will be known by your own harmful misconception. I’ll question the mendicants about this.”	mn22	7	1	mn	22	The Simile of the Snake	near Sāvatthī in Jeta’s Grove, Anāthapiṇḍika’s monastery	Kosala
mn22:8.1	Then the Buddha said to the mendicants, “Mendicants, do you understand my teachings as Ariṭṭha does, when he misrepresents me by his wrong grasp, harms himself, and makes much bad karma?” “No, sir. For in many ways the Buddha has said that obstructive acts are obstructive, and that they really do obstruct the one who performs them. The Buddha has said that sensual pleasures give little gratification and much suffering and distress, and they are all the more full of drawbacks. With the similes of a skeleton … a snake’s head, the Buddha has said that sensual pleasures give little gratification and much suffering and distress, and they are all the more full of drawbacks.” “Good, good, mendicants! It’s good that you understand my teaching like this. For in many ways I have said that obstructive acts are obstructive … I’ve said that sensual pleasures give little gratification and much suffering and distress, and they are all the more full of drawbacks. But still this Ariṭṭha misrepresents me by his wrong grasp, harms himself, and makes much bad karma. This will be for his lasting harm and suffering.	mn22	8	1	mn	22	The Simile of the Snake	near Sāvatthī in Jeta’s Grove, Anāthapiṇḍika’s monastery	Kosala
mn22:9.1	Truly, mendicants, it’s not possible to perform sensual acts without sensual pleasures, sensual perceptions, and sensual thoughts. Take a foolish person who memorizes the teaching— statements, songs, discussions, verses, inspired exclamations, legends, stories of past lives, amazing stories, and classifications. But they don’t examine the meaning of those teachings with wisdom, and so don’t come to a considered acceptance of them. They just memorize the teaching for the sake of finding fault and winning debates. They don’t realize the goal for which they memorized them. Because they’re wrongly grasped, those teachings lead to their lasting harm and suffering. Why is that? Because of their wrong grasp of the teachings. Suppose there was a person in need of a snake. And while wandering in search of a snake they’d see a big snake, and grasp it by the coil or the tail. But that snake would twist back and bite them on the hand or the arm or limb, resulting in death or deadly pain. Why is that? Because of their wrong grasp of the snake. In the same way, a foolish person memorizes the teaching … and those teachings lead to their lasting harm and suffering. Why is that? Because of their wrong grasp of the teachings. Now, take a gentleman who memorizes the teaching— statements, songs, discussions, verses, inspired exclamations, legends, stories of past lives, amazing stories, and classifications. And once he’s memorized them, he examines their meaning with wisdom, and comes to a considered acceptance of them. He doesn’t memorize the teaching for the sake of finding fault and winning debates. He realizes the goal for which he memorized them. Because they’re correctly grasped, those teachings lead to his lasting welfare and happiness. Why is that? Because of his correct grasp of the teachings. Suppose there was a person in need of a snake. And while wandering in search of a snake they’d see a big snake, and hold it down carefully with a cleft stick. Only then would they correctly grasp it by the neck. And even though that snake might wrap its coils around that person’s hand or arm or some other limb, that wouldn’t result in death or deadly pain. Why is that? Because of their correct grasp of the snake. In the same way, a gentleman memorizes the teaching … and those teachings lead to his lasting welfare and happiness. Why is that? Because of his correct grasp of the teachings. So, mendicants, when you understand what I’ve said, you should remember it accordingly. But if I’ve said anything that you don’t understand, you should ask me about it, or some competent mendicants.	mn22	9	1	mn	22	The Simile of the Snake	near Sāvatthī in Jeta’s Grove, Anāthapiṇḍika’s monastery	Kosala
mn22:13.1	Mendicants, I will teach you how the Dhamma is similar to a raft: it’s for crossing over, not for holding on. Listen and pay close attention, I will speak.” “Yes, sir,” they replied. The Buddha said this: “Suppose there was a person traveling along the road. They’d see a large deluge, whose near shore was dubious and perilous, while the far shore was a sanctuary free of peril. But there was no ferryboat or bridge for crossing over. They’d think, ‘Why don’t I gather grass, sticks, branches, and leaves and make a raft? Riding on the raft, and paddling with my hands and feet, I can safely reach the far shore.’ And so they’d do exactly that. And when they’d crossed over to the far shore, they’d think, ‘This raft has been very helpful to me. Riding on the raft, and paddling with my hands and feet, I have safely crossed over to the far shore. Why don’t I hoist it on my head or pick it up on my shoulder and go wherever I want?’ What do you think, mendicants? Would that person be doing what should be done with that raft?” “No, sir.” “And what, mendicants, should that person do with the raft? When they’d crossed over they should think, ‘This raft has been very helpful to me. … Why don’t I beach it on dry land or set it adrift on the water and go wherever I want?’ That’s what that person should do with the raft. In the same way, I have taught how the teaching is similar to a raft: it’s for crossing over, not for holding on. By understanding the simile of the raft, you will even give up the teachings, let alone what is against the teachings.	mn22	13	1	mn	22	The Simile of the Snake	near Sāvatthī in Jeta’s Grove, Anāthapiṇḍika’s monastery	Kosala
